{
  "schema": "legalbot.v111-integration-commit-ledger.v1",
  "captured_at": "2026-08-22T03:17:43Z",
  "authorizing": false,
  "range": "372b86f89e09d4c100c3de7d45d0bc0fb22829a3..ad70f0a687a7ae4993ae49c6df84abe36af06d56",
  "entry_count": 55,
  "allowed_dispositions": ["INCLUDE", "PARTIAL", "SUPERSEDED", "DEFER", "REJECT"],
  "evidence_profiles": {
    "implementation-retained": {
      "implementation": "present-in-integration-history",
      "focused_tests": "not-relied-on-until-exact-baseline-verification",
      "operational_gate": "not-run-or-claimed-by-this-ledger",
      "owner_authorization": "absent"
    },
    "infrastructure-retained-not-authority": {
      "implementation": "supporting-infrastructure-present-in-integration-history",
      "focused_tests": "not-relied-on-until-exact-baseline-verification",
      "operational_gate": "historical-or-infrastructure-only; no-current-gate-claim",
      "owner_authorization": "absent; Phase-2-or-later-decision-required"
    }
  },
  "entries": [
    {"sha":"64d16566ef55d4f1f553b5706b7cc7b521e02d57","disposition":"INCLUDE","profile":"implementation-retained","subject":"feat(governance): enforce owner-only decision stops"},
    {"sha":"f39e4d4bb551339e9bf12151f0ac64c31073f595","disposition":"INCLUDE","profile":"implementation-retained","subject":"feat(assessment): score every applicable sealed standard"},
    {"sha":"3846ebaf6e9b34d9da5132d28cd2be177d36b00c","disposition":"INCLUDE","profile":"implementation-retained","subject":"Enforce research gap crawl boundaries"},
    {"sha":"aafe268f2c078f54c6eed3760ca05c439735e1d2","disposition":"PARTIAL","profile":"infrastructure-retained-not-authority","subject":"feat(canary): add sealed review and split controls"},
    {"sha":"9850f5c5f5e941270909f0c75a353db440ad0431","disposition":"INCLUDE","profile":"implementation-retained","subject":"feat(quality): enforce evidence review and bounded repairs"},
    {"sha":"c19f3591c9b907f171b195503a75d850a373727d","disposition":"INCLUDE","profile":"implementation-retained","subject":"feat(index): reuse exact vectors in new sealed candidates"},
    {"sha":"e85054fb8fac109c96ffc1ba44ba0cc6ae87fe38","disposition":"PARTIAL","profile":"infrastructure-retained-not-authority","subject":"feat(evaluation): add candidate preflight and resumable stage A"},
    {"sha":"7dfb707e7cb40a1e2f64dc19a53a348ee324a428","disposition":"PARTIAL","profile":"infrastructure-retained-not-authority","subject":"feat(canary): authorize and freeze serial owner runs"},
    {"sha":"48f16dd2cdf78e5db16b11f34c135b168affed47","disposition":"INCLUDE","profile":"implementation-retained","subject":"fix(static): preserve typed governance schemas"},
    {"sha":"03e77fb5589912f6d0de841138dbed3f8d6be816","disposition":"INCLUDE","profile":"implementation-retained","subject":"fix(canary): share source draft identity"},
    {"sha":"dbac1b6cd51de1c1abacb009ce2ae1295a8b81aa","disposition":"INCLUDE","profile":"implementation-retained","subject":"chore(release): ignore runtime retrieval telemetry"},
    {"sha":"ce32d20227ce28a681ee51d3977d3d985e14ac62","disposition":"INCLUDE","profile":"implementation-retained","subject":"fix(canary): bind authorization to verified provenance"},
    {"sha":"f9d76b0a0752727b170a6ea76d77f5303424458e","disposition":"INCLUDE","profile":"implementation-retained","subject":"style(canary): format authorization provenance"},
    {"sha":"f8e1467a8e5e0ed56a1e25e4b2ea25d3978a467d","disposition":"INCLUDE","profile":"implementation-retained","subject":"Add provenance-safe retrieval re-attestation"},
    {"sha":"4f6190bd881b5132547a83e93792f408bd5349e1","disposition":"PARTIAL","profile":"infrastructure-retained-not-authority","subject":"feat(reviewer): resume sealed claim reviews"},
    {"sha":"798d296079ba433e783c95fd5146771b2a695583","disposition":"PARTIAL","profile":"infrastructure-retained-not-authority","subject":"feat(canary): require exact owner review projections"},
    {"sha":"0571fa5df3cad2dd8ae3f5d1a0a51a0eb7cefb97","disposition":"INCLUDE","profile":"implementation-retained","subject":"fix(release): harden reattestation and stage A provenance"},
    {"sha":"6e94afe62385022411e3099c2614b8914b29427f","disposition":"PARTIAL","profile":"infrastructure-retained-not-authority","subject":"feat(canary): seal owner feedback and review annex"},
    {"sha":"7a75d625a520515fc04400d3f6ab06316cf4d327","disposition":"PARTIAL","profile":"infrastructure-retained-not-authority","subject":"Enforce exact-30 owner canary acceptance"},
    {"sha":"940e99a8a7b83b89542db08c05441e55ad2d812a","disposition":"PARTIAL","profile":"infrastructure-retained-not-authority","subject":"fix(canary): stabilize owner review pagination"},
    {"sha":"504588733e495891e3a3b43bb38cb971a4f3e835","disposition":"PARTIAL","profile":"infrastructure-retained-not-authority","subject":"Gate v1.11 normal live on owner canaries"},
    {"sha":"97c4b2577ff79b91e28a8aaae28cbaef9c94ac89","disposition":"INCLUDE","profile":"implementation-retained","subject":"Require sealed candidate search before gap crawl"},
    {"sha":"1ee4e7a469a7b57ad99b193ea66e2d5151dbeafa","disposition":"INCLUDE","profile":"implementation-retained","subject":"Enforce bounded semantic retry circuits"},
    {"sha":"fa82d3f172169bd35a5834d783db876ee765cb17","disposition":"INCLUDE","profile":"implementation-retained","subject":"fix(static): type semantic admission updates"},
    {"sha":"1fc56dc0359fa223f902c8d5d1345dc235a3537b","disposition":"PARTIAL","profile":"infrastructure-retained-not-authority","subject":"Add exact all60 qualification and owner intake"},
    {"sha":"9f42cc46cb93cbd7327e450b642419f6ef4be599","disposition":"PARTIAL","profile":"infrastructure-retained-not-authority","subject":"Add nonrelease completion memory preflight"},
    {"sha":"1040bfdb334e6487473193bda830d83948ef363f","disposition":"INCLUDE","profile":"implementation-retained","subject":"Bind gap proofs to pinned retrieval execution"},
    {"sha":"20418eabe92a92a0058fff0129750908bc1c3a31","disposition":"PARTIAL","profile":"infrastructure-retained-not-authority","subject":"Verify owner canary split derivation"},
    {"sha":"c02528a12aed1956925ba9fdce8df5e8a5ff539b","disposition":"PARTIAL","profile":"infrastructure-retained-not-authority","subject":"Harden all60 evidence qualification"},
    {"sha":"855293ec901e68e10816f916015f9b8bd0d3cb62","disposition":"PARTIAL","profile":"infrastructure-retained-not-authority","subject":"Verify canary split before review intake"},
    {"sha":"d26925ca31204556d19109705685e4ef85d35c54","disposition":"PARTIAL","profile":"infrastructure-retained-not-authority","subject":"Add v1.11 owner-quality operability gates"},
    {"sha":"28048e3900c7ddf7a202b973e0814d2e1ac2bb7e","disposition":"PARTIAL","profile":"infrastructure-retained-not-authority","subject":"Harden owner review rendering and artifact I/O"},
    {"sha":"ccea182ab8e35fd60fa94763905d6b6385f23481","disposition":"PARTIAL","profile":"infrastructure-retained-not-authority","subject":"Harden owner review chain artifact I/O"},
    {"sha":"50a1ae1bef6d3e151deaff0e74688167323471a9","disposition":"PARTIAL","profile":"infrastructure-retained-not-authority","subject":"Harden authoritative completion preflight"},
    {"sha":"dd0a3ed66795752022326bb2eeabf0849528c4b8","disposition":"INCLUDE","profile":"implementation-retained","subject":"fix(preflight): isolate launcher configuration and bytecode"},
    {"sha":"4105db11b1d8d458a53005721eb404ced73852a9","disposition":"PARTIAL","profile":"infrastructure-retained-not-authority","subject":"Harden completion preflight replay"},
    {"sha":"0b5069ae38f8d14029b36f50cd266ff73325726a","disposition":"INCLUDE","profile":"implementation-retained","subject":"fix(preflight): bind launcher environment and start state"},
    {"sha":"3e5ca0b8231833efe7c693c2ddd138b6bec53e73","disposition":"INCLUDE","profile":"implementation-retained","subject":"Stop retries on attempt memory breaches"},
    {"sha":"73232b9154bfd0515fb35784cc9958e92eeffba0","disposition":"INCLUDE","profile":"implementation-retained","subject":"fix(preflight): report memory across all attempts"},
    {"sha":"993404039a525238ff6f26d223ebc17c63348fea","disposition":"PARTIAL","profile":"infrastructure-retained-not-authority","subject":"Add verified All60 AI review batch"},
    {"sha":"e980474c7b35ff7fedfb4bb2f0925de8b9ef0ded","disposition":"INCLUDE","profile":"implementation-retained","subject":"fix(evaluation): reject unsafe passed reviewer outcomes"},
    {"sha":"71c21cbe530a161e19683865ed78762b77394de3","disposition":"PARTIAL","profile":"infrastructure-retained-not-authority","subject":"Harden v1.11 owner-quality release gates"},
    {"sha":"f50144b197ec539586d8bc36defefba8df76c2e0","disposition":"INCLUDE","profile":"implementation-retained","subject":"Stop answer retry without changed condition"},
    {"sha":"953f91fce6370a6d8c3c1c88cbcf91e98c291801","disposition":"PARTIAL","profile":"infrastructure-retained-not-authority","subject":"Gate first-live startup before model spawn"},
    {"sha":"eaf1ed3badf5fcf65f2635df362dae33254bcd91","disposition":"PARTIAL","profile":"infrastructure-retained-not-authority","subject":"Own model runtime for owner canary"},
    {"sha":"c56317811efa4e32a8f251eb77bcffbafa228a48","disposition":"PARTIAL","profile":"infrastructure-retained-not-authority","subject":"Add replayable v1.11 technical attestation"},
    {"sha":"b69c7566dd8e267149736fecca8a958887404c99","disposition":"PARTIAL","profile":"infrastructure-retained-not-authority","subject":"Harden technical attestation result parsing"},
    {"sha":"84c74bacd72d8f3b144dd250d906a4cd38f3a520","disposition":"INCLUDE","profile":"implementation-retained","subject":"style(canary): format owned runtime integration"},
    {"sha":"6b58f74e7fb8fdac0d195a880efc76fefb729f89","disposition":"INCLUDE","profile":"implementation-retained","subject":"fix(canary): monitor owned runtime through shutdown"},